ID,TITLE,LOCATION,SALARY,SUMMARY
kr.indeed.com/viewjob?jk=07375dc4e800dfa9,추천 시스템 소프트웨어 엔지니어,카카오 4.0 성남 판교역,,"관련 업무 경험자 우대사항 운영체제, 네트워크, 컴파일러, 데이터베이스에 대한 이해가 깊으신 분 Python, C++, GPU 프로그래밍 숙련자 대용량/실시간 서비스 개발/운영 경험이 많으신 분 ICPC/TopCoder..."
kr.indeed.com/viewjob?jk=d1e75364ef505c68,"데이터 가치를 함께 발굴하실 머신러닝, 통계 모델링 전문가 모집",카카오 4.0 성남 판교역,,해당 기술에 자신감이 있으신 분도 환영합니다. 지원자격 머신 러닝/통계 등 모델링에 활용하는 언어( Python/Scala/R 등) 및 도구(Tensor flow/Pytorch 등)를 하나 이상 능숙하게 다룰 수 있으신...
kr.indeed.com/viewjob?jk=03b685211780bbb9,동진쎄미켐 IT 부문 신입사원,동진세미캠 서울 상암동,,"주요 업무 : ERP 시스템 개발 및 관리 - 우대사항 1) 전산 관련 전공 및 자격증 소지자 2) Python, JAVA, MS-SQL, 오라클 ERP 경험자 3) 어학(영어) 우수자 0명 서울 본사 (상암..."
kr.indeed.com/viewjob?jk=9040dba1c8db2a5d,퀀트운용팀 (사원-대리급),신한비엔피파리바자산운용 대한민국,,지식 보유자 - 투자자산운용사 자격증 소지자 우대 - CFA/CAIA/CPA 자격증 소지자 우대 - VBA/ Python 활용한 업무 가능자 우대 - 관련 전공 및 석박사 학위/금융 관련 자격증 보유자 우대 3. 전형방법...
kr.indeed.com/viewjob?jk=7fdcd7a7457b1e93,데이터 분석,아프리카TV 경기도 성남,,"의 서비스 이용/소비형태/이상현상과 트렌드 변화가 궁금하신 분 - B2C서비스 데이터 분석 직군에서 데이터 핸들링 경험이 있으신 분 - SQL,Excel,R, Python 등을 이용하여 데이터 추출 또는 분석이 가능하신 분"
kr.indeed.com/viewjob?jk=89d4053c832fee5a,Infra Biz본부 기술지원 계약직,SK텔레콤 4.0 대한민국,,"경험 보유자 우대 - Network Protocol, IP Network, 가상화, Android/ Python Programming 등 지식 보유자 우대 ※ 전형절차 : 서류전형 -> 면접전형 -> 인성검사/신체검사..."
kr.indeed.com/viewjob?jk=ce7813d9b3e818b5,위촉연구원 (에너지통계연구팀),에너지경제연구원 울산,,"우대사항 : SAS, R, Python, STATA, SPSS 등 통계분석... 경력 : 신입/경력(연차무관) 나이 : 무관 우대사항 SAS, R, Python, STATA, SPSS 등 통계분석패키지를 이용하여 데이터 분석을..."
kr.indeed.com/viewjob?jk=b102b3d8f193a4c1,2021 GEDP (Global Engineering Developmen...,GE Appliances 경기도 성남,,using C programming language Scripting languages like Lua/ Python/JavaScript may also be used if needed Support connected...
kr.indeed.com/viewjob?jk=f646e85ff3e17ed8,Data Scientist - IBM Garage,IBM 3.9 서울,,"programming languages to derive meaningful data insights (e.g., Python, R, Spark, TensorFlow, Jupyter, etc.) * Possess..."
kr.indeed.com/viewjob?jk=d98dfbbf0162cbb7,Vocational Training Program Intern (Inte...,SAP 4.3 서울,,"conditions Programming languages: C or C++ expertise, SQL, Python Intermediate communication skills in English Preferred..."
kr.indeed.com/viewjob?jk=02eeb14921bf1b94,"데이터 관련(엔지니어, 사이언티스트, 마케팅 직무) 경력사원",LG전자 3.8 서울 중구,,"필요 ④ Python, Java 등 프로그래밍 언어 역량 필요 2) Data scientist ① 빅데이터 분석/관리 및 관련 업무 경험 보유자 ② 통계 및 머신러닝 역량 필요 ③ SQL 역량 우대 ④ Python, R 등..."
