ID,TITLE,LOCATION,SALARY,SUMMARY
kr.indeed.com/viewjob?jk=4ec305f59ce64060,게임이상탐지 분석/개발,Nexon 성남 분당구,,"기법 적용에 필요한 프로그래밍 능력 ( Python) - SQL 활용 능력... 대시보드 개발 능력 솔루션 개발자 - 한 가지 이상의 개발 언어( Python, Java, Scala)에 숙련된 프로그래밍 능력 - Linux..."
kr.indeed.com/viewjob?jk=fa4084196836b8bc,[Clova CIC] 언어 모델 연구 및 대화 시스템 개발 인턴사원 (체...,네이버 서울,,"Learning, 수학/통계 관련 전공 석사 이상 학위 보유자 또는 이에 준하는 관련 프로젝트 경험 보유자 - Python 및 딥러닝 프레임워크 (PyTorch, Tensorflow) 개발 역량 - 새로운 기술이나 업무에..."
kr.indeed.com/viewjob?jk=e76216e61e1a67d9,기술 지원 엔지니어 - 주말전사,Dataiku 서울특별시,,"이지로 이동 합니다. 직무/산업 직무별(직종) 기술영업(IT.솔루션)기술지원 웹프로그래머웹프로그래머 인공지능(AI).빅데이터R, Python 기계.자동차.조선.철강엔지니어 산업별(업종) 솔루션.ASP.소프트웨어 소프트웨어개발"
kr.indeed.com/viewjob?jk=7bf179a290a157b2,경험최적화파트 - 머신러닝 엔지니어,Nexon 성남 분당구,,모델 개발 - 머신러닝을 위한 솔루션 프로토타이핑 - 머신러닝 파이프라인 설계 및 구축 지원자격 - Python에 숙련된 프로그래밍 능력과 머신러닝 라이브러리 활용 경험 - 머신러닝과 강화학습에 관련된 지식 습득 혹은...
kr.indeed.com/viewjob?jk=11e4f0710d52e762,Product Service Expert,Nova Measuring Instruments 경기도 화성,,"SEMI E10, SPC, TRIZ, structured problem solving, DOE, JMP, Python, and data analysis—an advantage Ability to travel—30..."
kr.indeed.com/viewjob?jk=add880a19f345249,"Customer Engineer, Machine Learning, Goo...",Google 4.3 서울,,"Caffe, as well as numerical programming frameworks... Python or MATLAB. Preferred qualifications: Master's degree..."
kr.indeed.com/viewjob?jk=385c58c7ced1d77b,데이터 사이언티스트를 지향하는 데이터 엔지니어 모집,카카오 4.0 성남 판교역,,"Spark 등 빅데이터 분석 플랫폼을 사용하여 대용량 데이터의 수집,가공이 가능한 분 프로그램 개발(Java, python 등) 기술을 보유하신 분 어떤 일이라도 중요하게 여기며 책임감 있게 진행할 수 있으신 분 자신의 생각..."
kr.indeed.com/viewjob?jk=1ff9cf4e96073310,"[메가스터디IT아카데미] 프로그래밍(python, c언어) 강사",커리어게이트 서울 마포구,,정보올림피아드 및 고입 프로그래밍 입시 유경험자 메가스터디교육그룹(IT학원) 프로그래밍 입시강사 채용 모집부문 및 자격요건 모집부문 담당업무 자격요건 인원 IT교육 코딩강사 코딩교육 프로그래밍강사 [담당업무...
kr.indeed.com/viewjob?jk=71c47ac87bb4087e,기술 인턴 인공지능 응용 연구/개발 인턴,써로마인드로보틱스 서울 관악구,,"6개월) (협의) *모집 절차: 서류 à인터뷰(오프라인) *지원 자격: 프로그래밍 언어 활용 능력: Python, C, C++ 중 1가지 이상 데이터구조, 알고리즘 과목 이수 머신러닝과 딥러닝의 기본 개념 이해 머신러닝..."
kr.indeed.com/viewjob?jk=7a10f3521337083b,"Perception Engineer, Deep Learning - Aut...",NVIDIA 서울,,"PyTorch, etc). Strong programming skills in C++... python. Outstanding communication and collaboration skills as we..."
kr.indeed.com/viewjob?jk=650893f0672cebc3,테크센터개발팀 - 웹 프로그래머,Nexon 성남 분당구,,"웹 어플리케이션 개발 경력 3년 이상 - 프로그래밍 언어 무관 (C#, Java, Javascript, Python, Go, PHP 등) - 프레임워크 무관 ( .NET MVC, Spring, node.js(Express..."
kr.indeed.com/viewjob?jk=9114939c6b62d6e7,부정 행위 탐지 서비스 개발을 위한 기계학습 전문가 모집,엔씨소프트 2.7 성남 판교역,,경험 - Spark / Hive / Jupyter notebook 등을 이용한 데이터 가공 및 분석 역량 - Python 혹은 R을 이용한 기계 학습 모델 개발 및 서비스 배포 역량 - 리눅스 서버 기반 서비스 개발 역량...
kr.indeed.com/viewjob?jk=63fa708f9257033a,Data Engineer,Dohands Company 서울,,"Requirements , Pandas / R / SAS Tableau Data Insight Python PostgreSql, MySQL DB SQL... Kaggle Kafka Machine Learning..."
kr.indeed.com/viewjob?jk=25725b3c0e607311,Junior Quant Trader,Byzantine Partners 서울,,background is a plus Programming capability is mandatory (i.e. Python) Understanding of machine learning algorithm is a plus...
kr.indeed.com/viewjob?jk=3b92a246b4535cd9,Senior Support Engineer (APAC),Dataiku 서울,,other database or BI technologies) Hands-on experience with Python... RWorking knowledge of various cloud technologies...
kr.indeed.com/viewjob?jk=112e58d399a83a19,BIM Manager,SYSTRA 서울,,"Openroads, Navigator. Microsoft: Office 365. IT language: Python (A plus) Others: Dynamo (A plus) Job Segment: Engineer..."
kr.indeed.com/viewjob?jk=9e1861e691426a98,Field AI Engineer,Graphcore 서울,,"hardware acceleration technologies Experience with Python and C++... depth knowledge of computer architectures, high..."
kr.indeed.com/viewjob?jk=4b15dd8e45f0fd01,AR App Engineer,Hyperconnect 서울,,"C/C++ OpenGL/Vulkan/Metal 1 ARcore ARKit 1 / / Java, Objective C(Swift), Python OpenCV (Image Processing... 10:00 - 7:00)"
kr.indeed.com/viewjob?jk=df21e3bb5d773616,Python Programmer,Mofac 서울 서초구,,개발 – JAVA 프로그래밍(라이브러리 활용) – Spring 프레임 워크 개발 – Python API 프로그래밍 우대사항 – Python 개발 경험 – Open Source 라이브러리 개발경험 – Web 표준에 대한 경험...
kr.indeed.com/viewjob?jk=c88c0631fb47d0b4,Cloud Architect,Oracle 3.8 서울,,"etc. Shell Script, Python or Java Script... development languages... Java and Python Development and operation experience..."
kr.indeed.com/viewjob?jk=9ab2041ab3380a21,카카오톡 안티어뷰징을 위한 데이터/백엔드 엔지니어 및 머신러닝 전문가 모...,카카오 4.0 성남 판교역,,"Engineer, Data Scientist 해당 분야에서 활용되는 언어 및 도구를 능숙하게 다룰 수 있는 분( Python, Scala, PyMC, PySpark, Tensorflow 등) 우대 사항 컨테이너 환경에서의..."
kr.indeed.com/viewjob?jk=b1b1b1e754bccf6b,Security Engineer (모의해킹/취약점 점검),Toss 서울 강남구,,"그바운트 경험이 있는 분 - 해킹대회 우승 경력이 있는 분 - 다양한 플랫폼 보안 진단 경험이 있는 분 - Python, C, C++, C#, JAVA 중 프로그래밍 언어에 능숙 하신 분 # 현업 인터뷰 - 토스가 투자 서비..."
kr.indeed.com/viewjob?jk=5555958bdde0c7ec,[해외취업] Teamlab (チームラボ)IT엔지니어 정규직,포유스 서울 문정동,"연봉 30,000,000원","아키텍처 설정, 처리의 자동화, 효율화, 범용화 2) 주요언어 ・Java、JavaScript、PHP、Ruby、 Python、Scala、Swift、Kotlin、C#、TypeScript、HTML5、CSS3등 ・SpringBoot..."
kr.indeed.com/viewjob?jk=78e99625e5de3c95,전문연구요원 (병역특례) 수시 (AI / HW 분야),딥엑스 성남 분당구,"연봉 40,000,000원 - 100,000,000원","모델의 RTL IP 설계 및 IP 검증 가능자 - Language: Python/Perl, C/C++ [우대 조건] - ARM based SoC 설계... Linux, shell, tcl, python, perl 사용 원활..."
kr.indeed.com/viewjob?jk=b95d00f1145e5ef3,(광주취업맛집1위)2021년도 국비 기술교육생,대한상공회의소 광주인력개발원 광주 광산구,,통신·모바일·게임>빅데이터·AI(인공지능)>데이터분석|인터넷·IT·통신·모바일·게임>빅데이터·AI(인공지능)> Python|인터넷·IT·통신·모바일·게임>빅데이터·AI(인공지능)>머신러닝|인터넷·IT·통신·모바일·게임>빅데이터...
kr.indeed.com/viewjob?jk=d05f4a61fa7270c9,Sr Field Engineer I,Raytheon Intelligence & Space 경기도 오산 +1 지역,,"Redhat Linux System Administration, UNIX shell/PERL/ python scripting, Cisco network administration, Oracle or Weblogic..."
kr.indeed.com/viewjob?jk=cd2ef993ee5c8d3f,지스트 블록체인인터넷경제연구센터 계약직(연구원),광주과학기술원 광주 북구,,록체인 개발 블록체인 하드포크 1) 4년제 대학 이상 졸업자 2) SW프로그래밍 제작 경험자 3) Python/C/Java/Go 프로그래밍 가능자 4) 팀장급은 개발 경험 10년 이상인 자 연구직 1명 우대사...
kr.indeed.com/viewjob?jk=96688eea9c1a9e28,Security Engineer (취약점 분석),Toss 서울 강남구,,"# 자격 요건 - 모의해킹 및 취약점 점검 경력이 있는 분 - 소스 코드 정적 취약점 점검에 능숙한 분 - Python, C, C++, JAVA 중 프로그래밍 언어에 능숙한 분 # 우대 사항 - 국내 또는 국외 버그 바운티..."
kr.indeed.com/viewjob?jk=a8f6efdd73ac2ab2,퀀트운용본부 경력사원,디비자산운용 대한민국,,"4년 이상 - 주식 및 시장에 대한 퀀트 / 계량적 접근방식 유경험자 - 프로그래밍 능력(VBA, R, Python 등) 보유 및 모델개발 경험자 우대 - 투자자산운용사 자격 보유자 - 영어 활용능력 우수자 우대 4. 전..."
kr.indeed.com/viewjob?jk=5e7dc1196f13b938,"NAVER, LINE 서비스 플랫폼 운영",NIT Service 성남 삼평동,,"유하신 분 - 프로그래밍 언어( python, java, c언어 등) 초급... System, WEB/WAS, DB운영 경험 - 프로그래밍 언어( python, java, c언어 등) 중급 이상 - 국가보훈대상자 및 장애인은..."
kr.indeed.com/viewjob?jk=3c516818303c4d51,Application Engineer (Silicondash),Synopsys 서울,,"disk access Programming skill of TCL, Perl, JavaScript or Python Good documentation and reporting skills are required..."
kr.indeed.com/viewjob?jk=a1d687cd59776360,머신러닝 개발,Nexon 성남 분당구,,모델 개발 - 머신러닝을 위한 솔루션 프로토타이핑 - 머신러닝 파이프라인 설계 및 구축 지원자격 - Python에 숙련된 프로그래밍 능력과 머신러닝 라이브러리 활용 경험 - 머신러닝과 강화학습에 관련된 지식 습득 혹은...
kr.indeed.com/viewjob?jk=2054288dc83a5a88,[진행중] 우리은행 AI사업부 전문직(인공지능(AI) 모델링 및 기획)...,우리은행 4.5 서울 회현동,,"서비스 기획 경험자 - Tensorflow, Pytorch 등 머신러닝 도구 활용 역량 보유 - Python, R 등 프로그래밍 활용 역량 보유 - 은행, 카드, 보험 등 금융 분야 프로젝트 경험자 우대사항..."
kr.indeed.com/viewjob?jk=c130ad24ffc25b72,기술연구소 (AI연구 및 Python개발 / 드론 영상처리),선영종합엔지니어링 고양 덕양구,,어링 기술연구소 (AI연구 및 Python개발 / 드론 영상처리) 채용 4... 프로그래밍 ㆍBig Data 활용 및 Smart plant ㆍR 및 Python 기반 프로그램 개발 ㆍ정부출연사업 제안서 작성 [근무부서 및 직급...
kr.indeed.com/viewjob?jk=46975ee759c13b8a,데이터 분석/처리 플랫폼 개발,NHN 4.4 성남 판교역,,"데이터 수집, 처리 및 지표 분석 경험 - 데이터 기반의 문제해결 역량 및 논리적 사고 - Java, Python, Scala 중 최소 1가지 언어를 이용한 데이터 분석 및 소프트웨어 개발 역량 - 통계분석..."
kr.indeed.com/viewjob?jk=96f919d43a5c77b6,2021년 혁신성장 청년인재 집중양성사업 교육생 (빅데이터/인공지능),한국생산성본부 4.0 서울 중구,,게임>웹프로그래머>백엔드|인터넷·IT·통신·모바일·게임>웹프로그래머> Python|인터넷·IT·통신·모바일·게임>응용프로그래머>C#|인터넷·IT·통신... 게임>빅데이터·AI(인공지능)> Python|인터넷·IT·통신·모바일·게임...
kr.indeed.com/viewjob?jk=c180958f6ef66e09,[국비무료/기숙사지원] 2021 혁신성장 빅데이터 분석가 양성 교육생,고려대학교 세종캠퍼스 세종특별자치시 세종,,모바일·게임>빅데이터·AI(인공지능)>데이터분석|인터넷·IT·통신·모바일·게임>빅데이터·AI(인공지능)> Python|인터넷·IT·통신·모바일·게임>빅데이터·AI(인공지능)>인공지능(AI)|인터넷·IT·통신·모바일·게임>빅데이...
kr.indeed.com/viewjob?jk=e5448ffc7d6ecf02,FPGA 플랫폼 엔지니어 (딥러닝 하드웨어 프로세서 개발),딥엑스 성남 분당구,"연봉 40,000,000원 - 100,000,000원","사용 경험(Chip Scope/SignalTap) - Language: Python/Perl, C/C++ - Vivado 또는 Synplify 또는... SignalTap) - Language: Python/Perl, C/C++..."
kr.indeed.com/viewjob?jk=dee1c9e840dc5691,"Field Application Engineer, Audio Implem...",Dolby 서울,,"Dolby’s ecosystem, products, business, and customers. Python coding skills. Interest in music, game/film audio or video..."
kr.indeed.com/viewjob?jk=073d76335475fce3,Data Science Manager,The Nielsen Company 3.8 서울,,automation and generalization. Working knowledge of Python or R. Knowledgeable with relational database management system...
kr.indeed.com/viewjob?jk=49d127c231640d09,Field Service Engineer,Novetta 서울,,"Experience with system administrative scripting. (bash, Python, etc.). Experience with modern server deployment techniques..."
kr.indeed.com/viewjob?jk=5ce610b12ceaed2f,[TmaxBI/기술] 빅데이터 플랫폼 QA,티맥스소프트 성남 분당구,,"갖춘자 - ERP/CRM 역량 보유자 - 데이터분석/모델링 역량 보유자 우대사항 - 보유기술: Java, python, RDB, NoSQL, OS(linux), Selenium, docker, Kubernetis - 자격사항..."
kr.indeed.com/viewjob?jk=8821ea2678923e80,Senior Applied Scientist,Amazon Web Services Korea LLC 서울,,"deep learning (e.g., CNN, RNN, LSTM) · Experience in using Python, R, or other programming language Machine learning (ML..."
kr.indeed.com/viewjob?jk=42414fb5112a2b24,Cloud Infrastructure Developer,SAP 4.3 서울,,Your tasks will include developing a python based scalable job execution platform... development with Python Experience...
kr.indeed.com/viewjob?jk=115c46e0d1df11d8,[개발자] 모비데이즈 프론트엔드 개발자 경력직 채용,Mobidays 서울특별시,,"험이 있으신 분 -활용 가능한 서버사이드 언어가 1개 이상 있는 분(Ruby, Java, Node.js, Python 등) -웹/모바일 광고 업계의 유사 업종 근무 경력 보유자 -플랫폼 또는 B2B 서비스 개발 프로젝트 참여..."
kr.indeed.com/viewjob?jk=5d8634c35a9f4b3d,SK 바이오팜 Digital Healthcare 경력직 (신약개발 Big...,SK 바이오팜 경기도,,"Pytorch, Keras 등) 연구 경력 보유 및 관련 논문 이해/ 활용 가능자 - 프로그래밍 언어 ( Python, R 등)를 활용한 OMICS 데이터 통계 분석 기술 보유 - 빅데이터 분석 경험, 유전체/ 의생명 데이..."
kr.indeed.com/viewjob?jk=e29ab2210c23b65f,[진행중] 우리은행 빅데이터사업부 전문직(데이터 사이언티스트(데이터분석가...,우리은행 4.5 서울 회현동,,ML/DL 기술을 활용한 분석모델 개발 및 서비스를 적용해 본 경험이 있는자 - 데이터 분석을 위한 언어( Python/R)를 하나 이상 능숙하게 다룰 수 있는자 우대사항 - 금융분야 ML/DL 관련 업무 경력 2년...
kr.indeed.com/viewjob?jk=e0e37aaebc73dde3,지표구축,아프리카TV 경기도 성남,,"대시보드 플랫폼의 활용이 가능하신분 - 새로운 서비스 출시후 모니터링이나 트랜드 확인이 가능하도록 설계나 지원이 가능하신분 - SQL,Excel,R, Python 등을 이용하여 데이터 추출 또는 분석이 가능하신 분"
kr.indeed.com/viewjob?jk=ae22088cdea0b40c,(주)아이옵스 소프트웨어 개발자,아이옵스 대전 유성구,,"트스트랩, 웹개발, C++, C#, python, java 등 1개 이상의... 우대사항] - 자바스크립트, 부트스트랩, 웹개발, C++, C#, python, java 등 1개 이상의 개발환경 능숙자 - Windows..."
kr.indeed.com/viewjob?jk=1679cd3717e62c42,PostgreSQL DBA 국내 IT대기업,경기도,,"운영 경험자 - 대규모 환경의 Oracle 운영 경험이 있고 PostgreSQL 운영 희망자 - JAVA, Python 등 개발능력 ※ 응시방법 - 한글이력서, 경력기술서, 자기소개서, 사진파일첨부 - 이메일지원 ysnam..."
kr.indeed.com/viewjob?jk=b9111853e8754517,고등광기술연구소 계약직 연구원,광주과학기술원 광주 북구,,"이저 연구/개발 2. 레이저/포토닉스-인공지능융합연구(Matlab/ Python,Labview/FPGA/Raspberry Pi 등 경험자, 혹은 공부... 인공지능 융합연구 (Matlab/ python,Labview/ FPGA..."
kr.indeed.com/viewjob?jk=044d94c9abc7aa58,"[채용연계형 인턴] SW 개발, QA, SW 컨설턴트",주식회사 파수 서울 마포구,"월급 2,300,000원","격요건 ㆍOS(Windows / Linux / Unix)의 기술적인 이해를 보유한 자 ㆍJava, C, Python 등의 언어 프로그래밍 스킬 ㆍDB(SQL svr / Oracle / Mania)의 기술적 이해 및 Query..."
kr.indeed.com/viewjob?jk=b1b1b1e754bccf6b,Security Engineer (모의해킹/취약점 점검),Toss 서울 강남구,,"그바운트 경험이 있는 분 - 해킹대회 우승 경력이 있는 분 - 다양한 플랫폼 보안 진단 경험이 있는 분 - Python, C, C++, C#, JAVA 중 프로그래밍 언어에 능숙 하신 분 # 현업 인터뷰 - 토스가 투자 서비..."
kr.indeed.com/viewjob?jk=073d76335475fce3,Data Science Manager,The Nielsen Company 3.8 서울,,automation and generalization. Working knowledge of Python or R. Knowledgeable with relational database management system...
kr.indeed.com/viewjob?jk=66d8a42fa933e7d0,2021년 상반기 정보보안 엔지니어 - 취약점파트,인섹시큐리티 서울 금천구,,10에 대한 설명과 구현/조치 가능 - 국내 컴플라이언스 대응 경험 (주요정보통신기반시설 가이드 등) - Python 활용자 - Kali 및 Metasploit 경험자 * 자격요건과 우대사항은 필수가 아닙니다. 0 명 근무조...
kr.indeed.com/viewjob?jk=49d127c231640d09,Field Service Engineer,Novetta 서울,,"Experience with system administrative scripting. (bash, Python, etc.). Experience with modern server deployment techniques..."
kr.indeed.com/viewjob?jk=0965f0c0615ab990,[계약직] AI 서비스 개발을 위한 엔지니어 모집 (서버 개발/텍스트 처...,엔씨소프트 2.7 성남 판교역,,"터를 꼼꼼하게 분석하고 정리할 수 있으신 분 - 자연어처리 (NLP) 관련 프로젝트 경험이 있으신 분 - Python 등을 이용하여 텍스트 수집, 분석, 정제 등의 처리가 가능하신 분 제출서류 포트폴리오(필수) 전형단계 서류..."
kr.indeed.com/viewjob?jk=5555958bdde0c7ec,[해외취업] Teamlab (チームラボ)IT엔지니어 정규직,포유스 서울 문정동,"연봉 30,000,000원","아키텍처 설정, 처리의 자동화, 효율화, 범용화 2) 주요언어 ・Java、JavaScript、PHP、Ruby、 Python、Scala、Swift、Kotlin、C#、TypeScript、HTML5、CSS3등 ・SpringBoot..."
kr.indeed.com/viewjob?jk=f6106c04181c4f89,"CTO부문 R&D 업무 지원 계약직 (공정/설비, 자동화 SW)",LG이노텍 4.1 서울 강서구,,"로그램 개발 [주요 업무] - Python 활용 사무 자동화 프로그램 개발... 모델링을 위한 데이터 정리 작업 [필요 경험/역량 및 우대사항] - Python 및 윈도우 프로그래밍 경험 - Wi-Fi, LAN, FTP, TCP..."
kr.indeed.com/viewjob?jk=a746de9c7a6168ef,Healthcare Real World Data Analyst 담당자,IQVIA 서울,,"HEOR 전반적인 업무 수행 Qualifications Claims Data 관련 분석 경력자 SAS / Python / R 등 통계 프로그래밍 언어 사용 가능자 통계학 전공자, 통계 및 Epidemiology 관련 석사..."
kr.indeed.com/viewjob?jk=1748baa27965fdbf,"MVP 개발 엔지니어(서버, 웹프론트) (정규직, 계약직, 프리랜서)",더테스터 대전 중구,,1년 이상의 서버 개발 경험 · 아래 옵션 중 하나의 기술 스택 사용 - JAVA기반의 Spring - Python 기반의 Django - Ruby 기반의 Rails 우대사항 · 팀단위로 프로젝트를 수주해본 적 있는...
kr.indeed.com/viewjob?jk=fec4bd361c177418,Associate Cloud Developer,Amazon Web Services Korea LLC 서울,,"languages: Java, Python, Ruby, Node.js... 동등한 수준의 STEM 관련 분야 학사 학위 혹은 경험 · Java, Python, Ruby, Node.js, C # 또는 C ++ 중 하나 이상의..."
kr.indeed.com/viewjob?jk=7a10f3521337083b,"Perception Engineer, Deep Learning - Aut...",NVIDIA 서울,,"PyTorch, etc). Strong programming skills in C++... python. Outstanding communication and collaboration skills as we..."
kr.indeed.com/viewjob?jk=f5f5f902d240ac96,Data Scientist,Toss 서울 강남구,,"또는 실무 경험 5년 이상 갖춘 분 - 실제 서비스 데이터를 이용한 분석모델 개발 경험이 있는 분 - R, Python, Scala, SQL 등 데이터 분석의 업무를 수행할 수 있는 하나 이상의 개발 언어에 능숙한 분 #..."
kr.indeed.com/viewjob?jk=d13fce11058e6cf1,보안 모니터링 시스템 개발 및 운영 담당자 모집,카카오 4.0 성남 판교역,,"이터 분석을 위한 SIEM/ETL 플랫폼 개발/운영 지원자격 기본사항 경력 3년 이상 Java, Python 등의 언어로 개발 가능자 기본적인 웹 개발 및 Back-End 개발 가능자 DBMS 혹은 빅데이터(NoSQL..."
kr.indeed.com/viewjob?jk=d69b5a1e60c65ce6,데이터 마케팅 경력사원,LG전자 3.8 서울 영등포구,,"경험 보유자 - 통계/개발 Tool 활용 능력 보유자 (SQL, R, Python, Scalar, Hadoop 등) 3) 우대 사항 - 높은 통계... 운영 경험자 - SQL, R, Python 등 통계 패키지 활용 자격증..."
kr.indeed.com/viewjob?jk=3e80435be74cd28f,블록체인인터넷경제연구센터 위촉연구원,광주과학기술원 광주 북구,,업무) 지원자격 연구직 O명 블록체인 연구 및 프로그래밍 제작 1) SW프로그래밍 제작 경험자 2) Python/C/Java/Go 프로그래밍 가능자 3) 블록체인 개발 경험자 우대 4) 컴퓨터공학 및 컴퓨터사이...
kr.indeed.com/viewjob?jk=7df915e1f0f86b2d,Software Architecture 설계 엔지니어,딥엑스 성남 분당구,"연봉 40,000,000원 - 100,000,000원",경험 - Windows/Linux 상에서 C++/ Python 언어 사용 개발 경험 - C++ / Python 언어 사용 개발 경험 - 객체지향 설계에... 게임>빅데이터·AI(인공지능)> Python|인터넷·IT·통신·모바일·게임...
kr.indeed.com/viewjob?jk=e8ff70f4dd69a226,플랫폼 개발,NHN 4.4 성남 판교역,,"개발 - C/C++ 또는 Java/ Python 개발 경력 5년 이상... RabbitMQ 등의 메시지 큐를 이용한 개발 경험 - C/C++, Python 등의 다양한 개발 언어 구사 함께 만들고 싶습니다..."
kr.indeed.com/viewjob?jk=ab8b221932fe27ef,[개발]E-Commerce 데이터 엔지니어/NLP개발자(정규직),위메프 2.8 대한민국,,개발 경력 3년 이상 - 분산파일 시스템 Hadoop 및 Spark 경험이 있는 분 - Java 및 Python 개발 능력을 보유한 분(중급 이상) - Hadoop Ecosysterm 운영 및 유지보수 경험이 있는 분...
kr.indeed.com/viewjob?jk=dee1c9e840dc5691,"Field Application Engineer, Audio Implem...",Dolby 서울,,"Dolby’s ecosystem, products, business, and customers. Python coding skills. Interest in music, game/film audio or video..."
kr.indeed.com/viewjob?jk=4910d33b5b470a5f,[Clova CIC] AI/ML 개발 인턴사원 (체험형),네이버 서울,,"대한 기본 지식 - PyTorch나 Tensorflow와 같은 딥러닝 프레임워크에 대한 지식 및 개발 경험 - Python을 사용한 소프트웨어 개발 경험 우대사항 - 컴퓨터과학, 컴퓨터 엔지니어링, 수학 및 관련 분야 전공..."
kr.indeed.com/viewjob?jk=65da831cb9d5a6b5,DGIST 계약직 연구원 및 일반직원 초빙 공고,대구경북과학기술원 대구 현풍면,,"구축 및 생물학 데이터 분석 Tool 개발 및 유지 다양한 프로그래밍(Java, Perl, C++, Python) 우대 사항 관련 분야 석사학위 소지자 유전체, 단백체, 대사체 데이터 분석 유경험자(3년 이상..."
kr.indeed.com/viewjob?jk=61de44a2ade660a0,정보보호 컨설팅 전문가 양성 과정,한국정보보호산업협회 서울,,로그래머>백엔드|인터넷·IT·통신·모바일·게임>웹프로그래머>프론트엔드|인터넷·IT·통신·모바일·게임>웹프로그래머> Python|인터넷·IT·통신·모바일·게임>웹프로그래머>ASP.NET|인터넷·IT·통신·모바일·게임>웹프로그래머...
kr.indeed.com/viewjob?jk=db55ee61f98e6816,DGIST 동반진단의료기술융합연구실 계약직 연구원 채용 공고,대구경북과학기술원 대구 현풍면,,데이터 통계 분석 AI 기반 데이터 분석을 위한 대용량 고속 데이터 처리 DB 구축 우대 사항 Python/Jave 기반 생체 정보 데이터 분석 경험자 대용량 고속 데이터 처리 DB 구축 경험자 급여수준...
kr.indeed.com/viewjob?jk=409c1253b2dde75b,동국대학교 데이터분석팀 연구원(계약직) 채용공고,동국대학교 4.3 서울 필동,,"자 4) 남자의 경우 병역필 또는 면제자 5) 한글, MS OFFICE 등 기본 문서작업 가능자 6) Python, R 프로그래밍 언어 사용 가능자 우대 2. 모집인원 : O명 3. 근무조건 및 계약기간 구 분..."
kr.indeed.com/viewjob?jk=e27c921dfbf357ac,네이버 클라우드 플랫폼 기술지원,NIT Service 성남 삼평동,,"클라우드 서비스 운영 경험 (AWS, Azure, KT Cloud 등) - Shell Script, Python 활용 가능 - 국가보훈대상자 및 장애인은 법령에 의거 우대 (※입사지원 시 보훈/장애사항 체크 필수..."
kr.indeed.com/viewjob?jk=489f19028e8a723b,통합인터페이스 백엔드 서버 개발,Nexon 성남 분당구,,"게임 빅데이터 실시간 처리 시스템 개발 지원자격 - 백엔드 서버 개발 경력 3년 이상 - Java, Python, Javascript 중 1개 이상의 프로그래밍 경험 - HTTP API 설계 및 개발 경험 - MSA..."
